19:05:48.949061 IP 147.182.158.168.22 > 142.188.60.29.58890: Flags [P.], seq 3918760083:3918760119, ack 726998106, win 501, length 36
19:05:48.949936 IP 147.182.158.168.22 > 142.188.60.29.58890: Flags [P.], seq 36:144, ack 1, win 501, length 108
19:05:48.950007 IP 147.182.158.168.22 > 142.188.60.29.58890: Flags [P.], seq 144:288, ack 1, win 501, length 144
19:05:48.950077 IP 147.182.158.168.22 > 142.188.60.29.58890: Flags [P.], seq 288:324, ack 1, win 501, length 36
19:05:48.958113 IP 142.188.60.29.58890 > 147.182.158.168.22: Flags [.], ack 144, win 2059, length 0
19:05:48.958114 IP 142.188.60.29.58890 > 147.182.158.168.22: Flags [.], ack 324, win 2064, length 0

